{
  "schema_version": 1,
  "ticker": "CLX",
  "period": "2025-FY",
  "as_of": "2025-08-08",
  "scope_note": "SEC filinginde ayrıştırılabilir Item 1A risk bölümü bulunamadı.",
  "analysis_status": "unavailable",
  "unavailable_reason_code": "risk_extraction_failed",
  "validation_findings": [],
  "risks": []
}
