{
  "schema_version": 1,
  "ticker": "MDLZ",
  "period": "2026-Q2",
  "as_of": "2026-02-04",
  "scope_note": "Son 10-K yeni ve ayrıntılı Item 1A riskleri sunmadığı için son 10-K risk bazını devralır; üç aylık filing ayrıca kontrol edilmiştir.",
  "analysis_status": "available",
  "unavailable_reason_code": null,
  "validation_findings": [],
  "risks": [
    {
      "risk_id": "competition_and_demand",
      "category": "market",
      "title": "Rekabet ve Tüketici Talebi Riski",
      "description": "Şirket, rekabet koşulları veya tüketici talebindeki değişimlerin faaliyet sonuçlarını olumsuz etkileyebileceğini bildiriyor.",
      "direction": "negative",
      "severity": "medium",
      "severity_rationale": "Önem derecesi, SEC filingindeki risk açıklamasının varlığını gösterir; olasılık veya parasal etki tahmin edilmemiştir.",
      "time_horizon": "long",
      "evidence": [
        {
          "source_id": "sec-0001628280-26-005345-risk-factors",
          "source_file": "raw/sec-filings/MDLZ/0001628280-26-005345-risk-factors.txt",
          "page": null,
          "summary": "laws affecting operations outside of the United States, including anti-bribery laws such as the Foreign Corrupt Practices Act (“FCPA”);•compliance with antitrust and competition laws,…"
        }
      ],
      "mitigants": null,
      "quantified_effect": null,
      "notes": "SEC Item 1A metninden deterministik anahtar kelime eşlemesiyle sınıflandırıldı."
    },
    {
      "risk_id": "supply_chain_and_inputs",
      "category": "operational",
      "title": "Tedarik Zinciri ve Girdi Maliyeti Riski",
      "description": "Şirket, tedarik zinciri kesintileri veya girdi maliyetlerindeki değişimlerin operasyonlarını ve marjlarını etkileyebileceğini bildiriyor.",
      "direction": "negative",
      "severity": "medium",
      "severity_rationale": "Önem derecesi, SEC filingindeki risk açıklamasının varlığını gösterir; olasılık veya parasal etki tahmin edilmemiştir.",
      "time_horizon": "long",
      "evidence": [
        {
          "source_id": "sec-0001628280-26-005345-risk-factors",
          "source_file": "raw/sec-filings/MDLZ/0001628280-26-005345-risk-factors.txt",
          "page": null,
          "summary": "In addition, we purchase and use significant quantities of product packaging materials, natural gas, fuel and electricity for our factories and warehouses, and we…"
        }
      ],
      "mitigants": null,
      "quantified_effect": null,
      "notes": "SEC Item 1A metninden deterministik anahtar kelime eşlemesiyle sınıflandırıldı."
    },
    {
      "risk_id": "cybersecurity_and_systems",
      "category": "operational",
      "title": "Siber Güvenlik ve Bilgi Sistemleri Riski",
      "description": "Şirket, siber olayların veya bilgi sistemi kesintilerinin operasyonları ve itibarı üzerinde olumsuz etki yaratabileceğini bildiriyor.",
      "direction": "negative",
      "severity": "medium",
      "severity_rationale": "Önem derecesi, SEC filingindeki risk açıklamasının varlığını gösterir; olasılık veya parasal etki tahmin edilmemiştir.",
      "time_horizon": "long",
      "evidence": [
        {
          "source_id": "sec-0001628280-26-005345-risk-factors",
          "source_file": "raw/sec-filings/MDLZ/0001628280-26-005345-risk-factors.txt",
          "page": null,
          "summary": "In addition, our operations may be subject to increased disruptions to our information systems, including through network failures, malicious or disruptive software or cyberattacks…"
        }
      ],
      "mitigants": null,
      "quantified_effect": null,
      "notes": "SEC Item 1A metninden deterministik anahtar kelime eşlemesiyle sınıflandırıldı."
    },
    {
      "risk_id": "regulation_and_litigation",
      "category": "regulatory",
      "title": "Düzenleyici ve Hukuki Riskler",
      "description": "Şirket, düzenleme, vergi veya hukuki süreçlerdeki değişimlerin maliyet ve faaliyet sonuçlarını etkileyebileceğini bildiriyor.",
      "direction": "negative",
      "severity": "medium",
      "severity_rationale": "Önem derecesi, SEC filingindeki risk açıklamasının varlığını gösterir; olasılık veya parasal etki tahmin edilmemiştir.",
      "time_horizon": "long",
      "evidence": [
        {
          "source_id": "sec-0001628280-26-005345-risk-factors",
          "source_file": "raw/sec-filings/MDLZ/0001628280-26-005345-risk-factors.txt",
          "page": null,
          "summary": "Our efforts to monitor our exposure to commodity prices and hedge against price increases cannot fully protect us from changes in input costs, including…"
        }
      ],
      "mitigants": null,
      "quantified_effect": null,
      "notes": "SEC Item 1A metninden deterministik anahtar kelime eşlemesiyle sınıflandırıldı."
    },
    {
      "risk_id": "foreign_currency_and_macro",
      "category": "financial",
      "title": "Döviz ve Makroekonomik Riskler",
      "description": "Şirket, döviz, enflasyon, faiz veya genel ekonomik koşullardaki değişimlerin sonuçlarını olumsuz etkileyebileceğini bildiriyor.",
      "direction": "negative",
      "severity": "medium",
      "severity_rationale": "Önem derecesi, SEC filingindeki risk açıklamasının varlığını gösterir; olasılık veya parasal etki tahmin edilmemiştir.",
      "time_horizon": "long",
      "evidence": [
        {
          "source_id": "sec-0001628280-26-005345-risk-factors",
          "source_file": "raw/sec-filings/MDLZ/0001628280-26-005345-risk-factors.txt",
          "page": null,
          "summary": "Moreover, increases in the price of our products, including increases to cover inflation and higher input, packaging and transportation costs, may result in lower…"
        }
      ],
      "mitigants": null,
      "quantified_effect": null,
      "notes": "SEC Item 1A metninden deterministik anahtar kelime eşlemesiyle sınıflandırıldı."
    },
    {
      "risk_id": "climate_and_environment",
      "category": "regulatory",
      "title": "İklim ve Çevresel Düzenleme Riski",
      "description": "Şirket, iklim olayları veya çevresel düzenlemelerin operasyon ve maliyet yapısını etkileyebileceğini bildiriyor.",
      "direction": "negative",
      "severity": "medium",
      "severity_rationale": "Önem derecesi, SEC filingindeki risk açıklamasının varlığını gösterir; olasılık veya parasal etki tahmin edilmemiştir.",
      "time_horizon": "long",
      "evidence": [
        {
          "source_id": "sec-0001628280-26-005345-risk-factors",
          "source_file": "raw/sec-filings/MDLZ/0001628280-26-005345-risk-factors.txt",
          "page": null,
          "summary": "Many of these conditions are or could be exacerbated or worsened by climate change."
        }
      ],
      "mitigants": null,
      "quantified_effect": null,
      "notes": "SEC Item 1A metninden deterministik anahtar kelime eşlemesiyle sınıflandırıldı."
    }
  ]
}
