{
  "schema_version": 1,
  "ticker": "NWL",
  "period": "2024-FY",
  "as_of": "2025-02-14",
  "scope_note": "10-K Item 1A risk metninden deterministik olarak çıkarılmıştır; önem derecesi ve parasal etki tahmin edilmemiştir.",
  "analysis_status": "available",
  "unavailable_reason_code": null,
  "validation_findings": [],
  "risks": [
    {
      "risk_id": "competition_and_demand",
      "category": "market",
      "title": "Rekabet ve Tüketici Talebi Riski",
      "description": "Şirket, rekabet koşulları veya tüketici talebindeki değişimlerin faaliyet sonuçlarını olumsuz etkileyebileceğini bildiriyor.",
      "direction": "negative",
      "severity": "medium",
      "severity_rationale": "Önem derecesi, SEC filingindeki risk açıklamasının varlığını gösterir; olasılık veya parasal etki tahmin edilmemiştir.",
      "time_horizon": "long",
      "evidence": [
        {
          "source_id": "sec-0000814453-25-000008-risk-factors",
          "source_file": "raw/sec-filings/NWL/0000814453-25-000008-risk-factors.txt",
          "page": null,
          "summary": "…manage operations, a risk of government enforcement action, litigation and possible liability, and reputational, competitive and/or business harm, which may adversely impact the Company’s results of operations and/or financial condition."
        }
      ],
      "mitigants": null,
      "quantified_effect": null,
      "notes": "SEC Item 1A metninden deterministik anahtar kelime eşlemesiyle sınıflandırıldı."
    },
    {
      "risk_id": "supply_chain_and_inputs",
      "category": "operational",
      "title": "Tedarik Zinciri ve Girdi Maliyeti Riski",
      "description": "Şirket, tedarik zinciri kesintileri veya girdi maliyetlerindeki değişimlerin operasyonlarını ve marjlarını etkileyebileceğini bildiriyor.",
      "direction": "negative",
      "severity": "medium",
      "severity_rationale": "Önem derecesi, SEC filingindeki risk açıklamasının varlığını gösterir; olasılık veya parasal etki tahmin edilmemiştir.",
      "time_horizon": "long",
      "evidence": [
        {
          "source_id": "sec-0000814453-25-000008-risk-factors",
          "source_file": "raw/sec-filings/NWL/0000814453-25-000008-risk-factors.txt",
          "page": null,
          "summary": "…including increased costs of supplies and disruptions of supply chains or IT or other necessary services for our Company. Federal, state, and local governments, as well as some of our…"
        }
      ],
      "mitigants": null,
      "quantified_effect": null,
      "notes": "SEC Item 1A metninden deterministik anahtar kelime eşlemesiyle sınıflandırıldı."
    },
    {
      "risk_id": "cybersecurity_and_systems",
      "category": "operational",
      "title": "Siber Güvenlik ve Bilgi Sistemleri Riski",
      "description": "Şirket, siber olayların veya bilgi sistemi kesintilerinin operasyonları ve itibarı üzerinde olumsuz etki yaratabileceğini bildiriyor.",
      "direction": "negative",
      "severity": "medium",
      "severity_rationale": "Önem derecesi, SEC filingindeki risk açıklamasının varlığını gösterir; olasılık veya parasal etki tahmin edilmemiştir.",
      "time_horizon": "long",
      "evidence": [
        {
          "source_id": "sec-0000814453-25-000008-risk-factors",
          "source_file": "raw/sec-filings/NWL/0000814453-25-000008-risk-factors.txt",
          "page": null,
          "summary": "…output, become inoperable or subject the Company to cybersecurity and data privacy breaches, all of which could lead to operational disruptions, flawed decision-making, increased costs, and an inhibited ability to…"
        }
      ],
      "mitigants": null,
      "quantified_effect": null,
      "notes": "SEC Item 1A metninden deterministik anahtar kelime eşlemesiyle sınıflandırıldı."
    },
    {
      "risk_id": "regulation_and_litigation",
      "category": "regulatory",
      "title": "Düzenleyici ve Hukuki Riskler",
      "description": "Şirket, düzenleme, vergi veya hukuki süreçlerdeki değişimlerin maliyet ve faaliyet sonuçlarını etkileyebileceğini bildiriyor.",
      "direction": "negative",
      "severity": "medium",
      "severity_rationale": "Önem derecesi, SEC filingindeki risk açıklamasının varlığını gösterir; olasılık veya parasal etki tahmin edilmemiştir.",
      "time_horizon": "long",
      "evidence": [
        {
          "source_id": "sec-0000814453-25-000008-risk-factors",
          "source_file": "raw/sec-filings/NWL/0000814453-25-000008-risk-factors.txt",
          "page": null,
          "summary": "…from any governmental investigations, product liability claims or regulatory actions could result in negative publicity that could harm the Company’s reputation in the marketplace, adversely impact the value of its…"
        }
      ],
      "mitigants": null,
      "quantified_effect": null,
      "notes": "SEC Item 1A metninden deterministik anahtar kelime eşlemesiyle sınıflandırıldı."
    },
    {
      "risk_id": "foreign_currency_and_macro",
      "category": "financial",
      "title": "Döviz ve Makroekonomik Riskler",
      "description": "Şirket, döviz, enflasyon, faiz veya genel ekonomik koşullardaki değişimlerin sonuçlarını olumsuz etkileyebileceğini bildiriyor.",
      "direction": "negative",
      "severity": "medium",
      "severity_rationale": "Önem derecesi, SEC filingindeki risk açıklamasının varlığını gösterir; olasılık veya parasal etki tahmin edilmemiştir.",
      "time_horizon": "long",
      "evidence": [
        {
          "source_id": "sec-0000814453-25-000008-risk-factors",
          "source_file": "raw/sec-filings/NWL/0000814453-25-000008-risk-factors.txt",
          "page": null,
          "summary": "…increase our pricing to offset these increased costs or if increased costs and prolonged inflation were to occur, it could materially and adversely affect our business, operating results and profitability."
        }
      ],
      "mitigants": null,
      "quantified_effect": null,
      "notes": "SEC Item 1A metninden deterministik anahtar kelime eşlemesiyle sınıflandırıldı."
    },
    {
      "risk_id": "climate_and_environment",
      "category": "regulatory",
      "title": "İklim ve Çevresel Düzenleme Riski",
      "description": "Şirket, iklim olayları veya çevresel düzenlemelerin operasyon ve maliyet yapısını etkileyebileceğini bildiriyor.",
      "direction": "negative",
      "severity": "medium",
      "severity_rationale": "Önem derecesi, SEC filingindeki risk açıklamasının varlığını gösterir; olasılık veya parasal etki tahmin edilmemiştir.",
      "time_horizon": "long",
      "evidence": [
        {
          "source_id": "sec-0000814453-25-000008-risk-factors",
          "source_file": "raw/sec-filings/NWL/0000814453-25-000008-risk-factors.txt",
          "page": null,
          "summary": "…ultimately found not to have infringed such rights. Climate change and increased focus by governmental and non-governmental organizations and customers on sustainability issues, including those related to climate change, may…"
        }
      ],
      "mitigants": null,
      "quantified_effect": null,
      "notes": "SEC Item 1A metninden deterministik anahtar kelime eşlemesiyle sınıflandırıldı."
    }
  ]
}
