{
  "schema_version": 1,
  "ticker": "DG",
  "period": "2024-FY",
  "as_of": "2025-03-21",
  "scope_note": "10-K Item 1A risk metninden deterministik olarak çıkarılmıştır; önem derecesi ve parasal etki tahmin edilmemiştir.",
  "analysis_status": "available",
  "unavailable_reason_code": null,
  "validation_findings": [],
  "risks": [
    {
      "risk_id": "competition_and_demand",
      "category": "market",
      "title": "Rekabet ve Tüketici Talebi Riski",
      "description": "Şirket, rekabet koşulları veya tüketici talebindeki değişimlerin faaliyet sonuçlarını olumsuz etkileyebileceğini bildiriyor.",
      "direction": "negative",
      "severity": "medium",
      "severity_rationale": "Önem derecesi, SEC filingindeki risk açıklamasının varlığını gösterir; olasılık veya parasal etki tahmin edilmemiştir.",
      "time_horizon": "long",
      "evidence": [
        {
          "source_id": "sec-0001558370-25-003413-risk-factors",
          "source_file": "raw/sec-filings/DG/0001558370-25-003413-risk-factors.txt",
          "page": null,
          "summary": "…are reasonable, will be successful. Business, Strategic and Competitive RisksEconomic factors may reduce our customers’ confidence and spending, impair our ability to execute our strategies and initiatives, and increase our…"
        }
      ],
      "mitigants": null,
      "quantified_effect": null,
      "notes": "SEC Item 1A metninden deterministik anahtar kelime eşlemesiyle sınıflandırıldı."
    },
    {
      "risk_id": "supply_chain_and_inputs",
      "category": "operational",
      "title": "Tedarik Zinciri ve Girdi Maliyeti Riski",
      "description": "Şirket, tedarik zinciri kesintileri veya girdi maliyetlerindeki değişimlerin operasyonlarını ve marjlarını etkileyebileceğini bildiriyor.",
      "direction": "negative",
      "severity": "medium",
      "severity_rationale": "Önem derecesi, SEC filingindeki risk açıklamasının varlığını gösterir; olasılık veya parasal etki tahmin edilmemiştir.",
      "time_horizon": "long",
      "evidence": [
        {
          "source_id": "sec-0001558370-25-003413-risk-factors",
          "source_file": "raw/sec-filings/DG/0001558370-25-003413-risk-factors.txt",
          "page": null,
          "summary": "…shortages or work stoppages or slowdowns in the transportation industry or disruptions to the national and international transportation infrastructure that necessitate our securing alternative labor or shipping suppliers could also…"
        }
      ],
      "mitigants": null,
      "quantified_effect": null,
      "notes": "SEC Item 1A metninden deterministik anahtar kelime eşlemesiyle sınıflandırıldı."
    },
    {
      "risk_id": "cybersecurity_and_systems",
      "category": "operational",
      "title": "Siber Güvenlik ve Bilgi Sistemleri Riski",
      "description": "Şirket, siber olayların veya bilgi sistemi kesintilerinin operasyonları ve itibarı üzerinde olumsuz etki yaratabileceğini bildiriyor.",
      "direction": "negative",
      "severity": "medium",
      "severity_rationale": "Önem derecesi, SEC filingindeki risk açıklamasının varlığını gösterir; olasılık veya parasal etki tahmin edilmemiştir.",
      "time_horizon": "long",
      "evidence": [
        {
          "source_id": "sec-0001558370-25-003413-risk-factors",
          "source_file": "raw/sec-filings/DG/0001558370-25-003413-risk-factors.txt",
          "page": null,
          "summary": "…stores, the temporary or long-term inability to obtain or access technology needed to effectively run our business, disruption of our utility services or information systems, and damage to our reputation."
        }
      ],
      "mitigants": null,
      "quantified_effect": null,
      "notes": "SEC Item 1A metninden deterministik anahtar kelime eşlemesiyle sınıflandırıldı."
    },
    {
      "risk_id": "regulation_and_litigation",
      "category": "regulatory",
      "title": "Düzenleyici ve Hukuki Riskler",
      "description": "Şirket, düzenleme, vergi veya hukuki süreçlerdeki değişimlerin maliyet ve faaliyet sonuçlarını etkileyebileceğini bildiriyor.",
      "direction": "negative",
      "severity": "medium",
      "severity_rationale": "Önem derecesi, SEC filingindeki risk açıklamasının varlığını gösterir; olasılık veya parasal etki tahmin edilmemiştir.",
      "time_horizon": "long",
      "evidence": [
        {
          "source_id": "sec-0001558370-25-003413-risk-factors",
          "source_file": "raw/sec-filings/DG/0001558370-25-003413-risk-factors.txt",
          "page": null,
          "summary": "…stock for reasons unrelated to our operating performance. Regulatory, Legal, Compliance and Accounting RisksA significant change in governmental regulations and requirements could materially increase our cost of doing business, and…"
        }
      ],
      "mitigants": null,
      "quantified_effect": null,
      "notes": "SEC Item 1A metninden deterministik anahtar kelime eşlemesiyle sınıflandırıldı."
    },
    {
      "risk_id": "foreign_currency_and_macro",
      "category": "financial",
      "title": "Döviz ve Makroekonomik Riskler",
      "description": "Şirket, döviz, enflasyon, faiz veya genel ekonomik koşullardaki değişimlerin sonuçlarını olumsuz etkileyebileceğini bildiriyor.",
      "direction": "negative",
      "severity": "medium",
      "severity_rationale": "Önem derecesi, SEC filingindeki risk açıklamasının varlığını gösterir; olasılık veya parasal etki tahmin edilmemiştir.",
      "time_horizon": "long",
      "evidence": [
        {
          "source_id": "sec-0001558370-25-003413-risk-factors",
          "source_file": "raw/sec-filings/DG/0001558370-25-003413-risk-factors.txt",
          "page": null,
          "summary": "…credit and capital markets, including market disruptions, limited liquidity and interest rate increases, may increase the cost of financing or restrict our access to these potential sources of future liquidity."
        }
      ],
      "mitigants": null,
      "quantified_effect": null,
      "notes": "SEC Item 1A metninden deterministik anahtar kelime eşlemesiyle sınıflandırıldı."
    },
    {
      "risk_id": "climate_and_environment",
      "category": "regulatory",
      "title": "İklim ve Çevresel Düzenleme Riski",
      "description": "Şirket, iklim olayları veya çevresel düzenlemelerin operasyon ve maliyet yapısını etkileyebileceğini bildiriyor.",
      "direction": "negative",
      "severity": "medium",
      "severity_rationale": "Önem derecesi, SEC filingindeki risk açıklamasının varlığını gösterir; olasılık veya parasal etki tahmin edilmemiştir.",
      "time_horizon": "long",
      "evidence": [
        {
          "source_id": "sec-0001558370-25-003413-risk-factors",
          "source_file": "raw/sec-filings/DG/0001558370-25-003413-risk-factors.txt",
          "page": null,
          "summary": "…in areas impacted by the physical risks of climate change, and we face the risk of losses incurred as a result of physical damage to stores, distribution centers, or our…"
        }
      ],
      "mitigants": null,
      "quantified_effect": null,
      "notes": "SEC Item 1A metninden deterministik anahtar kelime eşlemesiyle sınıflandırıldı."
    }
  ]
}
