{
  "schema_version": 1,
  "ticker": "FIZZ",
  "period": "2025-FY",
  "as_of": "2025-07-02",
  "scope_note": "10-K Item 1A risk metninden deterministik olarak çıkarılmıştır; önem derecesi ve parasal etki tahmin edilmemiştir.",
  "analysis_status": "available",
  "unavailable_reason_code": null,
  "validation_findings": [],
  "risks": [
    {
      "risk_id": "competition_and_demand",
      "category": "market",
      "title": "Rekabet ve Tüketici Talebi Riski",
      "description": "Şirket, rekabet koşulları veya tüketici talebindeki değişimlerin faaliyet sonuçlarını olumsuz etkileyebileceğini bildiriyor.",
      "direction": "negative",
      "severity": "medium",
      "severity_rationale": "Önem derecesi, SEC filingindeki risk açıklamasının varlığını gösterir; olasılık veya parasal etki tahmin edilmemiştir.",
      "time_horizon": "long",
      "evidence": [
        {
          "source_id": "sec-0001437749-25-022007-risk-factors",
          "source_file": "raw/sec-filings/FIZZ/0001437749-25-022007-risk-factors.txt",
          "page": null,
          "summary": "Competition in the labor marketplace for qualified employees has led to increased costs, such as higher wages and benefit costs in order to recruit and retain employees."
        }
      ],
      "mitigants": null,
      "quantified_effect": null,
      "notes": "SEC Item 1A metninden deterministik anahtar kelime eşlemesiyle sınıflandırıldı."
    },
    {
      "risk_id": "supply_chain_and_inputs",
      "category": "operational",
      "title": "Tedarik Zinciri ve Girdi Maliyeti Riski",
      "description": "Şirket, tedarik zinciri kesintileri veya girdi maliyetlerindeki değişimlerin operasyonlarını ve marjlarını etkileyebileceğini bildiriyor.",
      "direction": "negative",
      "severity": "medium",
      "severity_rationale": "Önem derecesi, SEC filingindeki risk açıklamasının varlığını gösterir; olasılık veya parasal etki tahmin edilmemiştir.",
      "time_horizon": "long",
      "evidence": [
        {
          "source_id": "sec-0001437749-25-022007-risk-factors",
          "source_file": "raw/sec-filings/FIZZ/0001437749-25-022007-risk-factors.txt",
          "page": null,
          "summary": "If raw materials or energy costs increase, or their availability is limited, our financial position could be adversely affected."
        }
      ],
      "mitigants": null,
      "quantified_effect": null,
      "notes": "SEC Item 1A metninden deterministik anahtar kelime eşlemesiyle sınıflandırıldı."
    },
    {
      "risk_id": "cybersecurity_and_systems",
      "category": "operational",
      "title": "Siber Güvenlik ve Bilgi Sistemleri Riski",
      "description": "Şirket, siber olayların veya bilgi sistemi kesintilerinin operasyonları ve itibarı üzerinde olumsuz etki yaratabileceğini bildiriyor.",
      "direction": "negative",
      "severity": "medium",
      "severity_rationale": "Önem derecesi, SEC filingindeki risk açıklamasının varlığını gösterir; olasılık veya parasal etki tahmin edilmemiştir.",
      "time_horizon": "long",
      "evidence": [
        {
          "source_id": "sec-0001437749-25-022007-risk-factors",
          "source_file": "raw/sec-filings/FIZZ/0001437749-25-022007-risk-factors.txt",
          "page": null,
          "summary": "8 Table of Contents Cybersecurity and dependence on information technology and third-party service providers."
        }
      ],
      "mitigants": null,
      "quantified_effect": null,
      "notes": "SEC Item 1A metninden deterministik anahtar kelime eşlemesiyle sınıflandırıldı."
    },
    {
      "risk_id": "regulation_and_litigation",
      "category": "regulatory",
      "title": "Düzenleyici ve Hukuki Riskler",
      "description": "Şirket, düzenleme, vergi veya hukuki süreçlerdeki değişimlerin maliyet ve faaliyet sonuçlarını etkileyebileceğini bildiriyor.",
      "direction": "negative",
      "severity": "medium",
      "severity_rationale": "Önem derecesi, SEC filingindeki risk açıklamasının varlığını gösterir; olasılık veya parasal etki tahmin edilmemiştir.",
      "time_horizon": "long",
      "evidence": [
        {
          "source_id": "sec-0001437749-25-022007-risk-factors",
          "source_file": "raw/sec-filings/FIZZ/0001437749-25-022007-risk-factors.txt",
          "page": null,
          "summary": "…to the environment or to effectively respond to regulatory requirements concerning climate change could lead to adverse publicity, which could result in reduced demand for our products, damage to our…"
        }
      ],
      "mitigants": null,
      "quantified_effect": null,
      "notes": "SEC Item 1A metninden deterministik anahtar kelime eşlemesiyle sınıflandırıldı."
    },
    {
      "risk_id": "foreign_currency_and_macro",
      "category": "financial",
      "title": "Döviz ve Makroekonomik Riskler",
      "description": "Şirket, döviz, enflasyon, faiz veya genel ekonomik koşullardaki değişimlerin sonuçlarını olumsuz etkileyebileceğini bildiriyor.",
      "direction": "negative",
      "severity": "medium",
      "severity_rationale": "Önem derecesi, SEC filingindeki risk açıklamasının varlığını gösterir; olasılık veya parasal etki tahmin edilmemiştir.",
      "time_horizon": "long",
      "evidence": [
        {
          "source_id": "sec-0001437749-25-022007-risk-factors",
          "source_file": "raw/sec-filings/FIZZ/0001437749-25-022007-risk-factors.txt",
          "page": null,
          "summary": "A prolonged labor shortage or inflation in labor costs could adversely impact our financial results."
        }
      ],
      "mitigants": null,
      "quantified_effect": null,
      "notes": "SEC Item 1A metninden deterministik anahtar kelime eşlemesiyle sınıflandırıldı."
    },
    {
      "risk_id": "climate_and_environment",
      "category": "regulatory",
      "title": "İklim ve Çevresel Düzenleme Riski",
      "description": "Şirket, iklim olayları veya çevresel düzenlemelerin operasyon ve maliyet yapısını etkileyebileceğini bildiriyor.",
      "direction": "negative",
      "severity": "medium",
      "severity_rationale": "Önem derecesi, SEC filingindeki risk açıklamasının varlığını gösterir; olasılık veya parasal etki tahmin edilmemiştir.",
      "time_horizon": "long",
      "evidence": [
        {
          "source_id": "sec-0001437749-25-022007-risk-factors",
          "source_file": "raw/sec-filings/FIZZ/0001437749-25-022007-risk-factors.txt",
          "page": null,
          "summary": "Strikes, weather conditions (including conditions caused by climate change), governmental controls, tariffs, national emergencies, natural disasters, supply shortages or other events could also affect our continued supply and cost of…"
        }
      ],
      "mitigants": null,
      "quantified_effect": null,
      "notes": "SEC Item 1A metninden deterministik anahtar kelime eşlemesiyle sınıflandırıldı."
    }
  ]
}
