{
  "schema_version": 1,
  "ticker": "SJM",
  "period": "2026-Q3",
  "as_of": "2026-02-26",
  "scope_note": "Son 10-Q yeni ve ayrıntılı Item 1A riskleri sunmadığı için son 10-K risk bazını devralır; üç aylık filing ayrıca kontrol edilmiştir.",
  "analysis_status": "unavailable",
  "unavailable_reason_code": "risk_extraction_failed",
  "validation_findings": [],
  "risks": []
}
