{
  "schema_version": 1,
  "ticker": "PEP",
  "period": "2025-FY",
  "as_of": "2026-02-03",
  "scope_note": "10-K Item 1A risk metninden deterministik olarak çıkarılmıştır; önem derecesi ve parasal etki tahmin edilmemiştir.",
  "analysis_status": "available",
  "unavailable_reason_code": null,
  "validation_findings": [],
  "risks": [
    {
      "risk_id": "competition_and_demand",
      "category": "market",
      "title": "Rekabet ve Tüketici Talebi Riski",
      "description": "Şirket, rekabet koşulları veya tüketici talebindeki değişimlerin faaliyet sonuçlarını olumsuz etkileyebileceğini bildiriyor.",
      "direction": "negative",
      "severity": "medium",
      "severity_rationale": "Önem derecesi, SEC filingindeki risk açıklamasının varlığını gösterir; olasılık veya parasal etki tahmin edilmemiştir.",
      "time_horizon": "long",
      "evidence": [
        {
          "source_id": "sec-0000077476-26-000007-risk-factors",
          "source_file": "raw/sec-filings/PEP/0000077476-26-000007-risk-factors.txt",
          "page": null,
          "summary": "Any inability on our part to anticipate or react to changes in consumer preferences and trends, or make the right strategic investments to do…"
        }
      ],
      "mitigants": null,
      "quantified_effect": null,
      "notes": "SEC Item 1A metninden deterministik anahtar kelime eşlemesiyle sınıflandırıldı."
    },
    {
      "risk_id": "supply_chain_and_inputs",
      "category": "operational",
      "title": "Tedarik Zinciri ve Girdi Maliyeti Riski",
      "description": "Şirket, tedarik zinciri kesintileri veya girdi maliyetlerindeki değişimlerin operasyonlarını ve marjlarını etkileyebileceğini bildiriyor.",
      "direction": "negative",
      "severity": "medium",
      "severity_rationale": "Önem derecesi, SEC filingindeki risk açıklamasının varlığını gösterir; olasılık veya parasal etki tahmin edilmemiştir.",
      "time_horizon": "long",
      "evidence": [
        {
          "source_id": "sec-0000077476-26-000007-risk-factors",
          "source_file": "raw/sec-filings/PEP/0000077476-26-000007-risk-factors.txt",
          "page": null,
          "summary": "In addition, our business operations, including our supply chain, are subject to disruption by geopolitical events and tensions, wars and other military conflicts, natural…"
        }
      ],
      "mitigants": null,
      "quantified_effect": null,
      "notes": "SEC Item 1A metninden deterministik anahtar kelime eşlemesiyle sınıflandırıldı."
    },
    {
      "risk_id": "cybersecurity_and_systems",
      "category": "operational",
      "title": "Siber Güvenlik ve Bilgi Sistemleri Riski",
      "description": "Şirket, siber olayların veya bilgi sistemi kesintilerinin operasyonları ve itibarı üzerinde olumsuz etki yaratabileceğini bildiriyor.",
      "direction": "negative",
      "severity": "medium",
      "severity_rationale": "Önem derecesi, SEC filingindeki risk açıklamasının varlığını gösterir; olasılık veya parasal etki tahmin edilmemiştir.",
      "time_horizon": "long",
      "evidence": [
        {
          "source_id": "sec-0000077476-26-000007-risk-factors",
          "source_file": "raw/sec-filings/PEP/0000077476-26-000007-risk-factors.txt",
          "page": null,
          "summary": "In addition, the rapid evolution and increased adoption of artificial intelligence technologies may increase our cybersecurity risks, including generative artificial intelligence augmenting threat actors’…"
        }
      ],
      "mitigants": null,
      "quantified_effect": null,
      "notes": "SEC Item 1A metninden deterministik anahtar kelime eşlemesiyle sınıflandırıldı."
    },
    {
      "risk_id": "regulation_and_litigation",
      "category": "regulatory",
      "title": "Düzenleyici ve Hukuki Riskler",
      "description": "Şirket, düzenleme, vergi veya hukuki süreçlerdeki değişimlerin maliyet ve faaliyet sonuçlarını etkileyebileceğini bildiriyor.",
      "direction": "negative",
      "severity": "medium",
      "severity_rationale": "Önem derecesi, SEC filingindeki risk açıklamasının varlığını gösterir; olasılık veya parasal etki tahmin edilmemiştir.",
      "time_horizon": "long",
      "evidence": [
        {
          "source_id": "sec-0000077476-26-000007-risk-factors",
          "source_file": "raw/sec-filings/PEP/0000077476-26-000007-risk-factors.txt",
          "page": null,
          "summary": "These risks could be heightened in light of new or evolving regulations, changes to our portfolio (including increased use of functional or other ingredients),…"
        }
      ],
      "mitigants": null,
      "quantified_effect": null,
      "notes": "SEC Item 1A metninden deterministik anahtar kelime eşlemesiyle sınıflandırıldı."
    },
    {
      "risk_id": "foreign_currency_and_macro",
      "category": "financial",
      "title": "Döviz ve Makroekonomik Riskler",
      "description": "Şirket, döviz, enflasyon, faiz veya genel ekonomik koşullardaki değişimlerin sonuçlarını olumsuz etkileyebileceğini bildiriyor.",
      "direction": "negative",
      "severity": "medium",
      "severity_rationale": "Önem derecesi, SEC filingindeki risk açıklamasının varlığını gösterir; olasılık veya parasal etki tahmin edilmemiştir.",
      "time_horizon": "long",
      "evidence": [
        {
          "source_id": "sec-0000077476-26-000007-risk-factors",
          "source_file": "raw/sec-filings/PEP/0000077476-26-000007-risk-factors.txt",
          "page": null,
          "summary": "Our ability to do so has been and may continue to be impacted by challenges in the labor market, which has experienced and may…"
        }
      ],
      "mitigants": null,
      "quantified_effect": null,
      "notes": "SEC Item 1A metninden deterministik anahtar kelime eşlemesiyle sınıflandırıldı."
    },
    {
      "risk_id": "climate_and_environment",
      "category": "regulatory",
      "title": "İklim ve Çevresel Düzenleme Riski",
      "description": "Şirket, iklim olayları veya çevresel düzenlemelerin operasyon ve maliyet yapısını etkileyebileceğini bildiriyor.",
      "direction": "negative",
      "severity": "medium",
      "severity_rationale": "Önem derecesi, SEC filingindeki risk açıklamasının varlığını gösterir; olasılık veya parasal etki tahmin edilmemiştir.",
      "time_horizon": "long",
      "evidence": [
        {
          "source_id": "sec-0000077476-26-000007-risk-factors",
          "source_file": "raw/sec-filings/PEP/0000077476-26-000007-risk-factors.txt",
          "page": null,
          "summary": "Any of the foregoing can adversely affect our business.13Table of ContentsWater scarcity can adversely affect our business.We and our business partners use water in…"
        }
      ],
      "mitigants": null,
      "quantified_effect": null,
      "notes": "SEC Item 1A metninden deterministik anahtar kelime eşlemesiyle sınıflandırıldı."
    }
  ]
}
